{
  "$schema": "https://json-schema.org/draft/2020-12/schema",
  "title": "Bounded startup cold-volume preservation",
  "type": "object",
  "additionalProperties": false,
  "required": [
    "schema_version",
    "operation",
    "guard_unit",
    "runtime",
    "source_archive"
  ],
  "properties": {
    "schema_version": {
      "const": 1
    },
    "operation": {
      "const": {
        "state": "defined",
        "stage": "startup_database_preservation",
        "id": "nautobot-startup-database-preservation-v1",
        "authorization_ready": true,
        "target": "j2-svpi4mf"
      }
    },
    "guard_unit": {
      "const": "nautobot-startup-preservation-unused"
    },
    "runtime": {
      "const": {
        "artifact_sha256": {
          "nautobot-private.network": "0bbf16ca337942502efffc0adb6a8694671c16ee143ee83b7b6009cb753fbc63",
          "nautobot-postgresql_data.volume": "0d570e4cc759483781ac5c4fa2162591d3a60c2978e0be7bfcdb6996ffbe3e7a",
          "nautobot-redis_data.volume": "b2a22985771b52cac95550657feea845252072a82ec3844f48bcda25666dd717",
          "nautobot-postgresql.container": "463902d338977c13cf9b76949663868ad2822c3e3baa5c8bc37979b9aa204905",
          "nautobot-redis.container": "906dc8bfe8741781a62ad01c82ec7f65603eadf425573e0c4f0f64d967e033a9",
          "nautobot-migration.container": "f1e96d625d4b11d299131e850bf1c39c84df831b3ce6576e95cf44421a98656c"
        },
        "configuration_sha256": "ec21369b4f7185c4c2a60e6614f2040c926704c8c0c90fb0700904197b86da90",
        "images": {
          "custom": {
            "reference": "localhost/nautobot-homelab@sha256:ceb4d6dfa82db1e70d472c01260d980d9e7497d9c8185d6bd7716e5d377856bf",
            "id": "808655787a970700a5d45aa3487f2b9072b3bba555f424eb9c91003da37160aa"
          },
          "postgresql": {
            "reference": "docker.io/library/postgres@sha256:e2fddda1fea39c634dccdae58dba5448eb3efb85aaa4054cf45cbed28f35d296",
            "id": "46b040d73e39b84f4a9d0ddd2bcea65bffd8ddfb94caaf2b1ea977ce3d292acf"
          },
          "redis": {
            "reference": "docker.io/library/redis@sha256:f263147977eb1178e361aba3af435b45175eb59ba136ce28a9479b163b4f8323",
            "id": "82899179477d3b2ff89eaba14d2a97b8a60bb233bb80fbf80681023bef052c93"
          }
        },
        "expected_boot_id": "70c9f650-a6a2-4583-84a9-f96462bef393"
      }
    },
    "source_archive": {
      "const": {
        "tag": "nautobot-administrator-bootstrap-v2-accepted",
        "commit": "17dbc01d45e591ebcbc019865f1ac010df7238bc"
      }
    }
  }
}
